{
  "name": "Slack Alert System",
  "description": "Intelligent alert system that routes notifications to appropriate Slack channels based on severity level",
  "version": "1.1.0",

  "tags": ["slack", "alerts", "notifications", "monitoring", "severity"],
  "author": "devops-team",
  "created": "2024-02-01",
  "updated": "2024-08-15",
  "n8n_version": "1.43.0",
  "requirements": {
    "credentials": ["slackApi"],
    "nodes": ["Webhook", "If", "Slack", "Respond to Webhook"],
    "environment_variables": [],
    "external_services": ["Slack API"]
  },
  "triggers": ["webhook"],
  "complexity": "low",
  "execution_time": "2-5 seconds",
  "resources": {
    "memory": "minimal",
    "cpu": "low",
    "storage": "minimal",
    "network": "low"
  },
  "business_impact": "high",
  "maintenance": {
    "frequency": "weekly",
    "last_reviewed": "2024-08-15",
    "next_review": "2024-09-15",
    "support_contact": "devops-team@company.com"
  },
  "testing": {
    "test_data_required": true,
    "test_environment": "staging",
    "validation_steps": [
      "Send test alert with critical severity",
      "Verify message appears in #alerts-critical channel",
      "Send test alert with warning severity",
      "Verify message appears in #alerts-general channel",
      "Check webhook response format"
    ],
    "known_issues": [
      "Slack API rate limits may cause delays during high alert volume",
      "Channel mentions require specific bot permissions"
    ]
  },
  "security": {
    "data_sensitivity": "internal",
    "compliance_requirements": [],
    "security_review_required": true
  },
  "documentation_urls": [
    "https://api.slack.com/messaging/webhooks",
    "https://api.slack.com/reference/surfaces/formatting"
  ],
  "changelog": [
    {
      "version": "1.1.0",
      "date": "2024-08-15",
      "changes": [
        "Added attachment formatting for better visibility",
        "Improved timestamp display",
        "Enhanced error handling"
      ],
      "breaking_changes": false
    },
    {
      "version": "1.0.0",
      "date": "2024-02-01",
      "changes": [
        "Initial release",
        "Basic severity-based routing",
        "Slack integration setup"
      ],
      "breaking_changes": false
    }
  ]
}