{
  "name": "Create Task in Initiative",
  "description": "This workflow creates a task in Notion based on incoming webhook data.",
  "version": "1.0.0",
  "tags": [
    "notion",
    "webhook",
    "task-creation"
  ],
  "author": "pw-software",
  "created": "2024-08-30",
  "updated": "2024-08-30",
  "n8n_version": "1.45.0",
  "requirements": {
    "credentials": [
      "Notion account"
    ],
    "nodes": [
      "n8n-nodes-base.webhook",
      "n8n-nodes-base.notion",
      "n8n-nodes-base.set"
    ],
    "environment_variables": []
  },
  "triggers": [
    "webhook"
  ],
  "complexity": "medium",
  "execution_time": "30-60 seconds",
  "resources": {
    "memory": "low",
    "cpu": "medium",
    "storage": "minimal"
  }
}