{
  "name": "Screenshot HTML Print Image",
  "description": "This workflow captures a screenshot of HTML content and sends it to a printer via an HTTP request.",
  "version": "1.0.0",
  "tags": [
    "html",
    "screenshot",
    "http-request",
    "redis"
  ],
  "author": "pw-software",
  "created": "2024-08-30",
  "updated": "2024-08-30",
  "n8n_version": "1.45.0",
  "requirements": {
    "credentials": [
      "Redis account",
      "HTMLToImage"
    ],
    "nodes": [
      "n8n-nodes-base.executeWorkflowTrigger",
      "n8n-nodes-base.redis",
      "n8n-nodes-base.httpRequest",
      "n8n-nodes-base.stopAndError",
      "n8n-nodes-base.noOp"
    ],
    "environment_variables": []
  },
  "triggers": [
    "manual"
  ],
  "complexity": "medium",
  "execution_time": "30-60 seconds",
  "resources": {
    "memory": "low",
    "cpu": "medium",
    "storage": "minimal"
  }
}